,Location,Coordinates,Latitude,Longitude
0,"Hitchin, United Kingdom","Hitchin, Hertfordshire, East of England, England, SG5, United Kingdom",51.9464129,-0.2791646
1,"London, United Kingdom","London, Greater London, England, SW1A 2DX, United Kingdom",51.5073219,-0.1276474
2,"Clacton-on-Sea, United Kingdom","Clacton-on-Sea, Essex, East of England, England, CO15 1QP, United Kingdom",51.78839970000001,1.1527865
3,"Maldon, United Kingdom","Maldon, Essex, East of England, England, United Kingdom",51.731198,0.6791849
4,"Essex, United Kingdom","Essex, East of England, England, United Kingdom",51.77046785,0.4646697741230039
5,"Gosport, United Kingdom","Gosport, Hampshire, South East, England, United Kingdom",50.795207399999995,-1.1210853
6,"Westgate-on-Sea, United Kingdom","Westgate-on-Sea, Kent, South East, England, CT8 8RF, United Kingdom",51.3815773,1.3372108
7,"Lowestoft, United Kingdom","Lowestoft, Suffolk, East of England, England, NR32 1HA, United Kingdom",52.476630799999995,1.7537638
8,"Buckinghamshire, United Kingdom","Buckinghamshire, South East, England, United Kingdom",51.783499400000004,-0.8946440535649794
9,"Tamworth, United Kingdom","Tamworth, Staffordshire, West Midlands, England, United Kingdom",52.6345819,-1.6948438000000001
10,"Hertford, United Kingdom","Hertford, Hertfordshire, East of England, England, SG14 1EZ, United Kingdom",51.7957409,-0.07852100000000001
11,"Bromley, United Kingdom","Bromley, London, Greater London, England, BR1 1EY, United Kingdom",51.4028046,0.0148142
12,"Banbury, United Kingdom","Banbury, Station Road, Banbury, Cherwell, Oxfordshire, South East, England, OX16 5AB, United Kingdom",52.06057120000001,-1.3277563000000001
13,"Warrington, United Kingdom","Warrington, North West England, England, WA1, United Kingdom",53.389949699999995,-2.5943178
14,"Nottingham, United Kingdom","City of Nottingham, East Midlands, England, United Kingdom",52.9534193,-1.1496461
15,"March, United Kingdom","March, Fenland, Cambridgeshire, East of England, England, PE15, United Kingdom",52.55059960000001,0.0880189
16,"Berkshire, United Kingdom","Berkshire, South East, England, United Kingdom",51.4534889,-1.0318729593399247
17,"Morden, United Kingdom","Morden, London Road, Morden, London Borough of Merton, London, Greater London, England, SM4 5BE, United Kingdom",51.4027615,-0.19475520000000002
18,"Boston, United Kingdom","Boston, Lincolnshire, East Midlands, England, United Kingdom",52.97704079999999,-0.023983599999999997
19,"Bognor Regis, United Kingdom","Bognor Regis, Arun, West Sussex, South East, England, United Kingdom",50.7834973,-0.6730718000000001
20,"Horsham, United Kingdom","Horsham, West Sussex, South East, England, United Kingdom",51.0630273,-0.3295028
21,"Christchurch, United Kingdom","Christchurch, South West England, England, BH23 1LJ, United Kingdom",50.7344198,-1.76512
22,"Salisbury, United Kingdom","Salisbury, Wiltshire, South West England, England, United Kingdom",51.0796895,-1.8074237640795872
23,"Bexhill-on-Sea, United Kingdom","Bexhill-on-Sea, Rother, East Sussex, South East, England, TN39 3PE, United Kingdom",50.8424384,0.4675723
24,"Birmingham, United Kingdom","Birmingham, West Midlands Combined Authority, West Midlands, England, United Kingdom",52.479699200000006,-1.9026911
25,"Biggleswade, United Kingdom","Biggleswade, Central Bedfordshire, East of England, England, SG18 0PR, United Kingdom",52.08820120000001,-0.2589013
26,"Eastleigh, United Kingdom","Eastleigh, Hampshire, South East, England, United Kingdom",50.9202217,-1.2992763684882789
27,"Reading, United Kingdom","Reading, South East, England, RG1 1DA, United Kingdom",51.456659,-0.9696511999999999
28,"Southampton, United Kingdom","Southampton, South East, England, SO14 2BY, United Kingdom",50.9025349,-1.404189
29,"Isle of Wight, United Kingdom","Isle of Wight, South East, England, United Kingdom",50.6710482,-1.332711113319946
30,"United Kingdom, United Kingdom",United Kingdom,54.70235450000001,-3.2765752999999997
31,"Great Yarmouth, United Kingdom","Great Yarmouth, Norfolk, East of England, England, United Kingdom",52.6072426,1.7310768
32,"Whitstable, United Kingdom","Whitstable, Kent, South East, England, United Kingdom",51.36062860000001,1.0240626
33,"Fulwood, United Kingdom","Fulwood, Sheffield, Yorkshire and the Humber, England, S10 3RN, United Kingdom",53.365013399999995,-1.5432431
34,"Bembridge, United Kingdom","Bembridge, Isle of Wight, South East, England, PO35 5XL, United Kingdom",50.6887044,-1.0849341000000001
35,"Leyland, United Kingdom","Leyland, Moss Lane, Turpin Green, South Ribble, Lancashire, North West England, England, PR25 4XA, United Kingdom",53.698564399999995,-2.686555
36,"Cheltenham, United Kingdom","Cheltenham, Gloucestershire, South West England, England, United Kingdom",51.8995685,-2.0711559
37,"Kent, United Kingdom","Kent, South East, England, United Kingdom",51.247482299999994,0.7105077
38,"Warwickshire, United Kingdom","Warwickshire, West Midlands, England, United Kingdom",52.32130635,-1.5467857874161073
39,"Bexley, United Kingdom","Bexley, London Borough of Bexley, London, Greater London, England, DA5 1LD, United Kingdom",51.4416793,0.150488
40,"West Wycombe, United Kingdom","West Wycombe, Buckinghamshire, South East, England, HP14 3AB, United Kingdom",51.6448823,-0.8022534
41,"Binfield, United Kingdom","Binfield, Bracknell Forest, South East, England, RG42 4NZ, United Kingdom",51.4321099,-0.7913628
42,"Felixstowe, United Kingdom","Felixstowe, Suffolk, East of England, England, United Kingdom",51.9639098,1.3515106000000001
43,"Turners Hill, United Kingdom","Turners Hill, Mid Sussex, West Sussex, South East, England, RH10 4PT, United Kingdom",51.103701,-0.0851164
44,"High Wycombe, United Kingdom","High Wycombe, Buckinghamshire, South East, England, United Kingdom",51.627421999999996,-0.7484153
45,"Northamptonshire, United Kingdom","Northamptonshire, East Midlands, England, United Kingdom",52.25,-0.833333
46,"Norwich, United Kingdom","Norwich, Norfolk, East of England, England, United Kingdom",52.62860600000001,1.29227
47,"Benalmadena, Spain","Benalmádena, Costa del Sol Occidental, Málaga, Andalucía, España",36.594519,-4.572284
48,"Addlestone, United Kingdom","Addlestone, Surrey, South East, England, United Kingdom",51.3710908,-0.48956750000000004
49,"Cheshunt, United Kingdom","Cheshunt, Broxbourne, Hertfordshire, East of England, England, EN8 9BW, United Kingdom",51.702052,-0.033590800000000004
50,"Chelmsford, United Kingdom","Chelmsford, Essex, East of England, England, United Kingdom",51.7345436,0.4724544
51,"Bournemouth, United Kingdom","Bournemouth, South West England, England, BH1 2BU, United Kingdom",50.7194784,-1.8767711999999999
52,"St Austell, United Kingdom","St. Austell, London Apprentice, Cornwall, South West England, England, United Kingdom",50.338466,-4.7882104000000005
53,"Lancing, United Kingdom","Lancing, Adur, West Sussex, South East, England, United Kingdom",50.82586660000001,-0.32255100000000003
54,"Braintree, United Kingdom","Braintree, Essex, East of England, England, United Kingdom",51.87806370000001,0.5537161
55,"Camberley, United Kingdom","Camberley, Surrey, South East, England, GU15 3SA, United Kingdom",51.3392845,-0.7460981
56,"Farnborough, United Kingdom","Farnborough, Hampshire, South East, England, GU14 7JT, United Kingdom",51.291869299999995,-0.7539836
57,"Stevenage, United Kingdom","Stevenage, Hertfordshire, East of England, England, United Kingdom",51.903509899999996,-0.20133679999999998
58,"Portsmouth, United Kingdom","Portsmouth, South East, England, PO1 5QH, United Kingdom",50.8036831,-1.0756139999999998
59,"Wickford, United Kingdom","Wickford, Essex, East of England, England, SS11 8BD, United Kingdom",51.6124948,0.5234742
60,"Heybridge, United Kingdom","Heybridge, Essex, East of England, England, CM9 4AJ, United Kingdom",51.7423283,0.6913195
61,"Milton Bridge, United Kingdom","Milton Bridge, Auchendinny, Midlothian, Scotland, EH26 0NS, United Kingdom",55.8504991,-3.1969790000000002
62,"Barking, United Kingdom","Barking, London, Greater London, England, IG11 8NL, United Kingdom",51.5389922,0.0804245
63,"East Horsley, United Kingdom","East Horsley, Surrey, South East, England, KT24 6QQ, United Kingdom",51.2766115,-0.43437709999999996
64,"Weston-super-Mare, United Kingdom","Weston-super-Mare, North Somerset, South West England, England, BS23 1SL, United Kingdom",51.3471927,-2.9778916
65,"Basingstoke, United Kingdom","Basingstoke, Basingstoke and Deane, Hampshire, South East, England, United Kingdom",51.262826000000004,-1.0861976
66,"Evesham, United Kingdom","Evesham, Worcestershire, West Midlands, England, WR11, United Kingdom",52.0940158,-1.9483082999999999
67,"Surrey, United Kingdom","Surrey, South East, England, United Kingdom",51.271531599999996,-0.3414523511290909
68,"Truro, United Kingdom","Truro, Kea, Cornwall, South West England, England, United Kingdom",50.2627515,-5.0520467
69,"Darlington, United Kingdom","Darlington, North East England, England, DL1 5QQ, United Kingdom",54.5242081,-1.5555812
70,"Borehamwood, United Kingdom","Borehamwood, Hertfordshire, East of England, England, WD6 5HL, United Kingdom",51.660486299999995,-0.27065059999999996
71,"Watford, United Kingdom","Watford, Hertfordshire, East of England, England, United Kingdom",51.6553875,-0.3957425
72,"Dorset, United Kingdom","Dorset, South West England, England, United Kingdom",50.79683685,-2.34473226124306
73,"Tonyrefail, United Kingdom","Tonyrefail, Rhondda Cynon Taf, Cymru / Wales, CF39, United Kingdom",51.5832675,-3.4311742999999995
74,"Blandford Forum, United Kingdom","Blandford Forum, Dorset, South West England, England, United Kingdom",50.8652479,-2.1571168563645413
75,"Liverpool, United Kingdom","Liverpool, North West England, England, United Kingdom",53.40715400000001,-2.9916650000000002
76,"Basildon, United Kingdom","Basildon, Essex, East of England, England, United Kingdom",51.5754602,0.4757363
77,"England, United Kingdom","England, United Kingdom",52.795479099999994,-0.5402402866174321
78,"Guildford, United Kingdom","Guildford, Surrey, South East, England, United Kingdom",51.2356068,-0.5732063000000001
79,"Felpham, United Kingdom","Felpham, Arun, West Sussex, South East, England, PO22 7PA, United Kingdom",50.7904582,-0.65412
80,"Crawley, United Kingdom","Crawley, West Sussex, South East, England, United Kingdom",51.110344399999995,-0.1801094
81,"Hertfordshire, United Kingdom","Hertfordshire, East of England, England, United Kingdom",51.8400523,-0.09785519224523964
82,"Havant, United Kingdom","Havant, Hampshire, South East, England, United Kingdom",50.83341970000001,-0.9826589433165432
83,"Llanymynech, United Kingdom","Llanymynech, Shropshire, West Midlands, England, SY22 6EJ, United Kingdom",52.780611,-3.0883335
84,"Shoeburyness, United Kingdom","Shoeburyness, Southend-on-Sea, East of England, England, SS3 9GA, United Kingdom",51.528442299999995,0.7955206
85,"Gravesend, United Kingdom","Gravesend, Kent, South East, England, United Kingdom",51.4422972,0.36962059999999997
86,"North Wales, United Kingdom","N, B5129, Saltney, Flintshire, Cymru / Wales, CH4 0BT, United Kingdom",53.1845436,-2.9733107999999997
87,"Borden, United Kingdom","Borden, Kent, South East, England, United Kingdom",51.3339492,0.7024809000000001
88,"Swindon, United Kingdom","Swindon, South West England, England, SN1 1JZ, United Kingdom",51.5613683,-1.7856853
89,"Sittingbourne, United Kingdom","Sittingbourne, Kent, South East, England, ME10 4AL, United Kingdom",51.3397366,0.7342319
90,"Leicester, United Kingdom","Leicester, East Midlands, England, LE1 5YA, United Kingdom",52.636139799999995,-1.1330788999999999
91,"Ipswich, United Kingdom","Ipswich, Suffolk, East of England, England, United Kingdom",52.0579495,1.1526345
92,"Orpington, United Kingdom","Orpington, London Borough of Bromley, London, Greater London, England, BR6 0NA, United Kingdom",51.3805351,0.1062656
93,"Crayford, United Kingdom","Crayford, Lower Station Road, Crayford, London Borough of Bexley, London, Greater London, England, DA1 3PW, United Kingdom",51.4481946,0.17836960000000002
94,"Rustington, United Kingdom","Rustington, Arun, West Sussex, South East, England, United Kingdom",50.811077399999995,-0.5101687
95,"Greater London, United Kingdom","Greater London, England, United Kingdom",51.4893335,-0.14405508452768728
96,"Staffordshire, United Kingdom","Staffordshire, West Midlands, England, United Kingdom",52.8246942,-2.0074546723348115
97,"Newhaven, United Kingdom","Newhaven, Lewes, East Sussex, South East, England, United Kingdom",50.7945315,0.0483875
98,"Harrogate, United Kingdom","Harrogate, North Yorkshire, Yorkshire and the Humber, England, United Kingdom",53.992149100000006,-1.5391039
99,"West Sussex, United Kingdom","West Sussex, South East, England, United Kingdom",50.94458445,-0.5278477012862655
100,"Hampshire, United Kingdom","Hampshire, South East, England, United Kingdom",51.04483545,-1.2434093603442158
101,"Lockerbie, United Kingdom","Lockerbie, Dumfries and Galloway, Scotland, DG11 2BL, United Kingdom",55.1274321,-3.3542699000000002
102,"Mansfield, United Kingdom","Mansfield, Nottinghamshire, East Midlands, England, United Kingdom",53.1447678,-1.1973365
103,"Halstead, United Kingdom","Halstead, Sevenoaks, Kent, South East, England, United Kingdom",51.32940085,0.13769401883498428
104,"Potters Bar, United Kingdom","Potters Bar, Hertsmere, Hertfordshire, East of England, England, EN6 2BD, United Kingdom",51.702588,-0.19556489999999999
105,"Belek, Turkey","Belek, Serik, Antalya, Akdeniz Bölgesi, 07506, Türkiye",36.8633459,31.057818400000002
106,"Brandon, United Kingdom","Brandon, West Suffolk, Suffolk, East of England, England, IP27 1AN, United Kingdom",52.448231299999996,0.6240803
107,"Canvey Island, United Kingdom","Canvey Island, Castle Point, Essex, East of England, England, United Kingdom",51.5276615,0.5647590301987852
108,"Blackpool, United Kingdom","Blackpool, North West England, England, FY1 1HE, United Kingdom",53.8182212,-3.0564845000000003
109,"Folkestone, United Kingdom","Folkestone, Kent, South East, England, CT20 1RZ, United Kingdom",51.07913350000001,1.1794073
110,"Lee-on-the-Solent, United Kingdom","Lee-on-the-Solent, Gosport, Hampshire, South East, England, United Kingdom",50.802898299999995,-1.2013355
111,"Ashford, United Kingdom","Ashford, Kent, South East, England, United Kingdom",51.148555,0.8722565999999999
112,"Epsom, United Kingdom","Epsom, Surrey, South East, England, KT19 8DX, United Kingdom",51.3326098,-0.2678212
113,"Gillingham, United Kingdom","Gillingham, South East, England, United Kingdom",51.3876562,0.5457711999999999
114,"Bedfordshire, United Kingdom","Bedfordshire, East of England, England, United Kingdom",52.0640034,-0.4111137556031093
115,"Sevenoaks, United Kingdom","Sevenoaks, Kent, South East, England, United Kingdom",51.27452185,0.1961165562194977
116,"Rainham, United Kingdom","Rainham, Gillingham, South East, England, ME8 0DG, United Kingdom",51.3642835,0.6014889
117,"Bedford, United Kingdom","Bedford, East of England, England, MK40 1SU, United Kingdom",52.1363806,-0.46750410000000003
118,"Chatham, United Kingdom","Chatham, Medway, South East, England, United Kingdom",51.380484499999994,0.5292758000000001
119,"Littlehampton, United Kingdom","Littlehampton, Arun, West Sussex, South East, England, BN17 5EJ, United Kingdom",50.80958010000001,-0.5424424
120,"Stansted Mountfitchet, United Kingdom","Stansted Mountfitchet, Essex, East of England, England, CM24 8LA, United Kingdom",51.9034971,0.19866520000000001
121,"Amesbury, United Kingdom","Amesbury, Wiltshire, South West England, England, United Kingdom",51.17068755,-1.7706128163886845
122,"Bath, United Kingdom","Bath, Chaucer Road, Beechen Cliff, Bath, Bath and North East Somerset, South West England, England, BA2 4QS, United Kingdom",51.38092635,-2.3741897151296603
123,"Oxford, United Kingdom","Oxford, Oxfordshire, South East, England, United Kingdom",51.7520131,-1.2578499
124,"Trowbridge, United Kingdom","Trowbridge, Wiltshire, South West England, England, BA14, United Kingdom",51.3195102,-2.2017864693935865
125,"Ampthill, United Kingdom","Ampthill, Central Bedfordshire, East of England, England, MK45 2JT, United Kingdom",52.0282071,-0.4955122
126,"Hastings, United Kingdom","Hastings, East Sussex, South East, England, United Kingdom",50.8553888,0.5824703
127,"Southend-on-Sea, United Kingdom","Southend-on-Sea, East of England, England, United Kingdom",51.54063195,0.7161146725194144
128,"Ilford, United Kingdom","Ilford, London, Greater London, England, IG1 1DL, United Kingdom",51.5582734,0.0711669
129,"Coventry, United Kingdom","Coventry, West Midlands Combined Authority, West Midlands, England, United Kingdom",52.4081812,-1.510477
130,"Ickenham, United Kingdom","Ickenham, Glebe Avenue, Hillingdon, London Borough of Hillingdon, London, Greater London, England, UB10 8PA, United Kingdom",51.5615698,-0.4423513
131,"Isle of Grain, United Kingdom","Isle of Grain, Medway, South East, England, ME3 0AJ, United Kingdom",51.45426550000001,0.6948865
132,"Grimsby, United Kingdom","Grimsby, North East Lincolnshire, Yorkshire and the Humber, England, DN32 9UT, United Kingdom",53.5677371,-0.0736289
133,"Henlow, United Kingdom","Henlow, Central Bedfordshire, East of England, England, SG16 6GA, United Kingdom",52.0323139,-0.28924629999999996
134,"Swanscombe, United Kingdom","Swanscombe, Kent, South East, England, DA10 0JB, United Kingdom",51.4436966,0.30657429999999997
135,"Fareham, United Kingdom","Fareham, Hampshire, South East, England, United Kingdom",50.85266370000001,-1.1783133999999995
136,"Manchester, United Kingdom","Manchester, Greater Manchester, North West England, England, United Kingdom",53.479489199999996,-2.2451147999999996
137,"Herne Bay, United Kingdom","Herne Bay, Kent, South East, England, United Kingdom",51.371950700000006,1.1306951
138,"East Sussex, United Kingdom","East Sussex, South East, England, United Kingdom",50.9404266,0.3699977891068864
139,"Tilehurst, United Kingdom","Tilehurst, Reading, South East, England, RG31 5AW, United Kingdom",51.457983899999995,-1.0409218
140,"Southport, United Kingdom","Southport, Sefton, North West England, England, PR8 1AH, United Kingdom",53.647598800000004,-3.0041751
141,"Cardiff, United Kingdom","Cardiff, Cymru / Wales, CF, United Kingdom",51.48165460000001,-3.1791934
142,"Ellesmere Port, United Kingdom","Ellesmere Port, Station Road, Rossmore Estate, Ellesmere Port, Cheshire West and Chester, North West England, England, CH65 4BW, United Kingdom",53.28211139999999,-2.8960456000000003
143,"Hereford, United Kingdom","Hereford, Herefordshire, West Midlands, England, HR1 2NB, United Kingdom",52.05538129999999,-2.7151735
144,"Ashtead, United Kingdom","Ashtead, Surrey, South East, England, KT21 2FH, United Kingdom",51.305522700000004,-0.3071682
145,"Brighton, United Kingdom","Brighton, Brighton and Hove, South East, England, United Kingdom",50.8220399,-0.1374061
146,"Westbury, United Kingdom","Westbury, Wiltshire, South West England, England, BA13 3DB, United Kingdom",51.261078999999995,-2.1836535
147,"Leighlinbridge, Ireland","Leighlinbridge, Leighlinbridge ED, County Carlow, Leinster, Ireland",52.7360233,-6.9766258
148,"Purley, United Kingdom","Purley, London Borough of Croydon, London, Greater London, England, CR8 2FQ, United Kingdom",51.3385156,-0.11589300000000001
149,"Derbyshire, United Kingdom","Derbyshire, East Midlands, England, United Kingdom",53.11850329999999,-1.5566179305872212
150,"Bury St Edmunds, United Kingdom","Bury St Edmunds, Suffolk, East of England, England, IP33 1BZ, United Kingdom",52.24603670000001,0.7125173
151,"Kingsnorth, United Kingdom","Kingsnorth, Kent, South East, England, TN23 3EH, United Kingdom",51.1184905,0.8598681999999999
152,"Mitcham, United Kingdom","Mitcham, London Borough of Merton, London, Greater London, England, CR4 3NA, United Kingdom",51.4058006,-0.1640787
153,"Hornchurch, United Kingdom","Hornchurch, London Borough of Havering, London, Greater London, England, RM12 6AF, United Kingdom",51.5613235,0.2212279
154,"Abu Dhabi, United Arab Emirates","أبوظبي, أبو ظبي, United Arab Emirates",24.474796100000002,54.3705762
155,"Romford, United Kingdom","Romford, London, Greater London, England, RM1 1RX, United Kingdom",51.57604620000001,0.1822646
156,"Poole, United Kingdom","Poole, South West England, England, BH15 1SU, United Kingdom",50.7179472,-1.9815209999999999
157,"Petersfield, United Kingdom","Petersfield, East Hampshire, Hampshire, South East, England, United Kingdom",51.0024945,-0.9392027000000001
158,"Watton, United Kingdom","Watton, Norfolk, East of England, England, IP25 6BE, United Kingdom",52.56991850000001,0.8253494
159,"Horndean, United Kingdom","Horndean, East Hampshire, Hampshire, South East, England, United Kingdom",50.9224506,-1.0022416709244524
160,"Windsor and Maidenhead, United Kingdom","Windsor and Maidenhead, South East, England, United Kingdom",51.4803412,-0.6769505204283354
161,"Northampton, United Kingdom","Northampton, Northamptonshire, East Midlands, England, United Kingdom",52.2381355,-0.8963906999999999
162,"Amersham, United Kingdom","Amersham, Chiltern Avenue, Amersham, Buckinghamshire, South East, England, HP6 5FG, United Kingdom",51.6740875,-0.6073643
163,"Aylesbury, United Kingdom","Aylesbury, Buckinghamshire, South East, England, United Kingdom",51.816141200000004,-0.8130383000000001
164,"Bicester, United Kingdom","Bicester, Oxfordshire, South East, England, OX26, United Kingdom",51.89888320000001,-1.1518287
165,"Norfolk, United Kingdom","Norfolk, East of England, England, United Kingdom",52.666667000000004,1.0
166,"Slough, United Kingdom","Slough, South East, England, SL1 1XU, United Kingdom",51.511101399999994,-0.5940681999999999
167,"Telford, United Kingdom","Telford, Telford and Wrekin, West Midlands, England, TF3 4HB, United Kingdom",52.6780419,-2.4514272999999998
168,"Lingfield, United Kingdom","Lingfield, Edenbrook, Lingfield, Tandridge, Surrey, South East, England, RH7 6EF, United Kingdom",51.1761001,-0.0068029
169,"Mumbai, India","Mumbai, Santa Cruz – Chembur Link Road, Hallow Pul, L Ward, Zone 5, Mumbai, Mumbai Suburban, Maharashtra, 400070, India",19.075989899999996,72.8773928
170,"Ystrad Mynach, United Kingdom","Ystrad Mynach, Caerphilly, Cymru / Wales, United Kingdom",51.6418098,-3.2373987
171,"Shropshire, United Kingdom","Shropshire, West Midlands, England, United Kingdom",52.65233935,-2.7958678599236624
172,"Rochester, United Kingdom","Rochester, Maidstone Road, Wouldham, Rochester, Medway, South East, England, ME1 3QU, United Kingdom",51.373925,0.4895943178424743
173,"Cambridge, United Kingdom","Cambridge, Cambridgeshire, East of England, England, United Kingdom",52.2034823,0.1235817
174,"Worthing, United Kingdom","Worthing, West Sussex, South East, England, United Kingdom",50.8116902,-0.37039479999999997
175,"Haverhill, United Kingdom","Haverhill, Suffolk, East of England, England, CB9 8GY, United Kingdom",52.0832721,0.4353932
176,"Shenley, United Kingdom","Shenley, Hertfordshire, East of England, England, WD7 9BS, United Kingdom",51.6922396,-0.28119679999999997
177,"USA, USA",United States,39.7837304,-100.4458825
178,"Hemel Hempstead, United Kingdom","Hemel Hempstead, Hertfordshire, East of England, England, HP1 1EW, United Kingdom",51.7511784,-0.47252799999999995
179,"Aylesham, United Kingdom","Aylesham, Bell Grove, Aylesham, Dover, Kent, South East, England, CT3 3AS, United Kingdom",51.2274229,1.2095904
180,"Erith, United Kingdom","Erith, London Borough of Bexley, London, Greater London, England, DA8 2GQ, United Kingdom",51.4775613,0.1823013
181,"Steyning, United Kingdom","Steyning, Horsham, West Sussex, South East, England, United Kingdom",50.890220299999996,-0.3302184
182,"Newcastle-upon-Tyne, United Kingdom","Newcastle upon Tyne, Tyne and Wear, North East England, England, United Kingdom",54.97384739999999,-1.6131572
183,"Wigan, United Kingdom","Wigan, Greater Manchester, North West England, England, United Kingdom",53.545718799999996,-2.6264624
184,"Chemsford, United Kingdom","Royal Mail Chemsford, Montrose Road, Dukes Park Industrial Estate, Springfield, Chelmsford, Essex, East of England, England, CM2 6ZZ, United Kingdom",51.74245360000001,0.5005752368921204
185,"Royal Tunbridge Wells, United Kingdom","Royal Tunbridge Wells, Tunbridge Wells, Kent, South East, England, TN1 2DL, United Kingdom",51.13714829999999,0.2673446
186,"Sandhurst, United Kingdom","Sandhurst, Bracknell Forest, South East, England, United Kingdom",51.35034055,-0.7872591564985778
187,"Cirencester, United Kingdom","Cirencester, Cotswold, Gloucestershire, South West England, England, GL7, United Kingdom",51.7170188,-1.9685298999999998
188,"Bexleyheath, United Kingdom","Bexleyheath, London, Greater London, England, DA7 4LN, United Kingdom",51.463485399999996,0.14805520000000005
189,"Ealing, United Kingdom","Ealing, London Borough of Ealing, London, Greater London, England, W5 5DG, United Kingdom",51.5126553,-0.3051952
190,"Newport, United Kingdom","Newport, Cymru / Wales, United Kingdom",51.58823320000001,-2.9974967
191,"Malaga, Spain","Málaga, Málaga-Costa del Sol, Málaga, Andalucía, España",36.7213028,-4.421636599999999
192,"Luton, United Kingdom","Luton, East of England, England, LU1 2YN, United Kingdom",51.8784385,-0.41528370000000003
193,"Croydon, United Kingdom","Croydon, London, Greater London, England, CR0 1SZ, United Kingdom",51.3713049,-0.101957
194,"Weymouth, United Kingdom","Weymouth, Wyke Regis, Dorset, South West England, England, United Kingdom",50.6096257,-2.4543424
195,"Fair Oak, United Kingdom","Fair Oak, Hampshire, South East, England, SO50 7AU, United Kingdom",50.9652971,-1.2998218000000001
