,Location,Coordinates,Latitude,Longitude
776,"Driffield, United Kingdom","Driffield, East Riding of Yorkshire, Yorkshire and the Humber, England, YO25 6LD, United Kingdom",54.0060463,-0.4388029000000001
777,"Ann Arbor, USA","Ann Arbor, Washtenaw County, Michigan, United States of America",42.268156899999994,-83.7312291
778,"Sompting, United Kingdom","Sompting, Adur, West Sussex, South East, England, BN15 0AP, United Kingdom",50.834789799999996,-0.35315250000000004
779,"Chania, Greece","Δήμος Χανίων, Περιφερειακή Ενότητα Χανίων, Περιφέρεια Κρήτης, Αποκεντρωμένη Διοίκηση Κρήτης, Ελλάδα",35.5120831,24.019154399999998
780,"Carlisle, United Kingdom","Carlisle, Cumbria, North West England, England, United Kingdom",54.8948478,-2.9362311
781,"Fuengirola, Spain","Fuengirola, Costa del Sol Occidental, Málaga, Andalucía, España",36.5387779,-4.623334799999999
782,"Alston, United Kingdom","Alston, Cumbria, North West England, England, CA9 3RF, United Kingdom",54.8122881,-2.4411172000000003
783,"Wimborne, United Kingdom","Wimborne, Brooksville Avenue, Brondesbury Park, Brondesbury, London Borough of Brent, London, Greater London, England, NW6 6TG, United Kingdom",51.53814570000001,-0.20840769963206945
784,"Church Gresley, United Kingdom","Church Gresley, South Derbyshire, Derbyshire, East Midlands, England, DE11 9NY, United Kingdom",52.7624874,-1.5696219999999999
785,"Porthleven, United Kingdom","Porthleven, Cornwall, South West England, England, TR13 9JB, United Kingdom",50.0849174,-5.3166557999999995
786,"Southwold, United Kingdom","Southwold, Suffolk, East of England, England, IP18 6JG, United Kingdom",52.3266586,1.6794539000000002
787,"Timperley, United Kingdom","Timperley, Trafford, Greater Manchester, North West England, England, WA15 7SB, United Kingdom",53.3961615,-2.3202602000000003
788,"Colac, Australia","Colac, Shire of Colac Otway, Victoria, 3250, Australia",-38.339655,143.58063649963287
789,"Bishopsteignton, United Kingdom","Bishopsteignton, Devon, South West England, England, TQ14 9RU, United Kingdom",50.552744399999995,-3.5443661
790,"Playa de las Americas, Spain","Playa de las Américas, Arona, Santa Cruz de Tenerife, Canarias, 38650, España",28.060197100000003,-16.7310532
791,"Rayleigh, United Kingdom","Rayleigh, Essex, East of England, England, SS6 7FR, United Kingdom",51.58848920000001,0.6012418
792,"Hatfield, United Kingdom","Hatfield, Hertfordshire, East of England, England, AL10 0JY, United Kingdom",51.7634675,-0.2258741
793,"Ashbourne, United Kingdom","Ashbourne, Derbyshire, East Midlands, England, DE6 1FG, United Kingdom",53.017332700000004,-1.7342724999999999
794,"Sault Ste. Marie, Canada","Sault Ste. Marie, Algoma District, Northeastern Ontario, Ontario, Canada",46.52391,-84.320068
795,"Chiang Mai, Thailand","เชียงใหม่, จังหวัดเชียงใหม่, 4452, ประเทศไทย",18.790876,98.98804799999999
796,"Northallerton, United Kingdom","Northallerton, Kilnwick Court, Romanby, Hambleton, North Yorkshire, Yorkshire and the Humber, England, DL7 8XS, United Kingdom",54.332988,-1.441689
797,"Eymet, France","Eymet, Bergerac, Dordogne, Nouvelle-Aquitaine, France métropolitaine, 24500, France",44.6681229,0.3984795
798,"Gettysburg, United States","Gettysburg, Adams County, Pennsylvania, United States of America",39.8308973,-77.23101199999998
799,"Tulsa, USA","Tulsa, Tulsa County, Oklahoma, United States of America",36.1556805,-95.9929113
800,"Tavares, USA","Tavares, Lake County, Florida, 32278, United States of America",28.78992535,-81.77516353978501
801,"Vancouver, Canada","Vancouver, Metro Vancouver Regional District, British Columbia, Canada",49.2608724,-123.11395290000002
802,"Stratford-upon-Avon, United Kingdom","Stratford-upon-Avon, Warwickshire, West Midlands, England, CV37 6AH, United Kingdom",52.1927885,-1.7063668
803,"Suzhou, China","宿州市, 埇桥区 (Yongqiao), 宿州市 / Suzhou, 安徽省, China 中国",33.648236600000004,116.9588062
804,"Longridge, United Kingdom","Longridge, Lancashire, North West England, England, PR3 3JA, United Kingdom",53.8299124,-2.6033482999999995
805,"North Holland Province, The Netherlands","Netherlands American Cemetery, Hoogsteeg, Margraten, Eijsden-Margraten, Limburg, Nederland, 6269AX, Nederland",50.81753240000001,5.807918742445188
806,"Clapham, United Kingdom","Clapham, London, Greater London, England, SW4 0BG, United Kingdom",51.4622924,-0.1388561
807,"Lyon, France","Lyon, Métropole de Lyon, Circonscription départementale du Rhône, Auvergne-Rhône-Alpes, France métropolitaine, France",45.75781370000001,4.8320114
808,"Eastcote, United Kingdom","Eastcote, Pinner, Ruislip, London, Greater London, England, HA4 8SZ, United Kingdom",51.579541799999994,-0.4016534
809,"Pewsey, United Kingdom","Pewsey, Wiltshire, South West England, England, SN9 5HD, United Kingdom",51.3420841,-1.7658565
810,"Capel Saint Mary, United Kingdom","Capel St Mary, Suffolk, East of England, England, IP9 2EA, United Kingdom",52.0027107,1.0545381
811,"Seattle, USA","Seattle, King County, Washington, United States of America",47.6038321,-122.3300624
812,"Orebic, Croatia","Orebić, Općina Orebić, Dubrovačko-neretvanska županija, 20250, Hrvatska",42.9769138,17.183236899999994
813,"Chilham, United Kingdom","Chilham, Kent, South East, England, CT4 8DL, United Kingdom",51.2447805,0.9645024
814,"Fleet, United Kingdom","Fleet, Hart, Hampshire, South East, England, United Kingdom",51.2828601,-0.8316334471979006
815,"Saskatoon, Canada","Saskatoon, Saskatchewan, S7K 8E9, Canada",52.131802,-106.66076699999999
816,"Sarasota, USA","Sarasota, Sarasota County, Florida, United States of America",27.3364347,-82.5306527
817,"Dishforth, United Kingdom","Dishforth, North Yorkshire, Yorkshire and the Humber, England, YO7 3JU, United Kingdom",54.15274839999999,-1.4163297
818,"Romania, Romania",România,45.98521289999999,24.6859225
819,"Cuckfield, United Kingdom","Cuckfield, Mid Sussex, West Sussex, South East, England, United Kingdom",51.00551289999999,-0.13931525984078488
820,"West Chiltington, United Kingdom","West Chiltington, Horsham, West Sussex, South East, England, RH20 2LA, United Kingdom",50.9558921,-0.44852
821,"Hamilton, New Zealand","Hamilton, Hamilton City, Waikato, 3204, New Zealand",-37.7878809,175.28178799999995
822,"london, United Kingdom","London, Greater London, England, SW1A 2DX, United Kingdom",51.5073219,-0.1276474
823,"Newcastle-under-Lyme, United Kingdom","Newcastle-under-Lyme, Staffordshire, West Midlands, England, United Kingdom",53.0117627,-2.2273918999999998
824,"Potterspury, United Kingdom","Potterspury, South Northamptonshire, Northamptonshire, East Midlands, England, United Kingdom",52.0786827,-0.9045071409875518
825,"San Francisco, USA","San Francisco, San Francisco City and County, California, United States of America",37.779026200000004,-122.4199061
826,"Baydon, United Kingdom","Baydon, Wiltshire, South West England, England, SN8 2JS, United Kingdom",51.5010219,-1.5959124
827,"Prague, Czech Republic","Praha, okres Hlavní město Praha, Hlavní město Praha, Praha, Česká republika",50.0874654,14.4212535
828,"Budapest, Hungary","Budapest, Közép-Magyarország, Magyarország",47.4983815,19.0404707
829,"Colorado, USA","Colorado, United States of America",38.7251776,-105.60771670000001
830,"Birdham, United Kingdom","Birdham, Chichester, West Sussex, South East, England, United Kingdom",50.79401045,-0.8336022067471976
831,"Great Plumstead, United Kingdom","Great Plumstead, Norfolk, East of England, England, NR13 5ER, United Kingdom",52.6416187,1.3996831
832,"Haworth, United Kingdom","Haworth, Bradford, West Yorkshire, Yorkshire and the Humber, England, United Kingdom",53.83061125,-1.9507939345042355
833,"Liss, United Kingdom","Liss, East Hampshire, Hampshire, South East, England, United Kingdom",51.0415389,-0.8994549640083951
834,"Merstham, United Kingdom","Merstham, Surrey, South East, England, RH1 3HT, United Kingdom",51.2607556,-0.1481817
835,"Despetal, Germany","Despetal, Gronau, Samtgemeinde Leinebergland, Landkreis Hildesheim, Niedersachsen, Deutschland",52.08918055,9.826850401841217
836,"Highworth, United Kingdom","Highworth, Swindon, South West England, England, SN6 7, United Kingdom",51.6313857,-1.7136365000000002
837,"West Clandon, United Kingdom","West Clandon, Surrey, South East, England, GU4 7TD, United Kingdom",51.2607921,-0.5041174
838,"Amberley, United Kingdom","Amberley, Horsham, West Sussex, South East, England, BN18 9NJ, United Kingdom",50.908910999999996,-0.5346514
839,"Copenhagen, Denmark","København, Københavns Kommune, Region Hovedstaden, 1357, Danmark",55.6867243,12.5700724
840,"Middleton-on-Sea, United Kingdom","Middleton on Sea, Arun, West Sussex, South East, England, PO22 7RX, United Kingdom",50.7905472,-0.620959
841,"Western Australia, Australia","Western Australia, Australia",-25.230300500000002,121.0187246
842,"Saint Die des Vosges, France","Saint-Dié-des-Vosges, Vosges, Grand Est, France métropolitaine, 88100, France",48.287315299999996,6.9477708
843,"Formentera Del Segura, Spain","Formentera del Segura, el Baix Segura / La Vega Baja del Segura, Alacant / Alicante, Comunitat Valenciana, España",38.0851143,-0.7459956
844,"Saffron Walden, United Kingdom","Saffron Walden, Essex, East of England, England, CB10 1NQ, United Kingdom",52.021569,0.2411256
845,"Golf del Sur, Spain","Golf del Sur, San Miguel de Abona, Santa Cruz de Tenerife, Canarias, 38639, España",28.0329968,-16.6077455
846,"Richmond, United Kingdom","Richmond, London, Greater London, England, TW9 1DY, United Kingdom",51.461353100000004,-0.3032767
847,"King's Lynn, United Kingdom","King's Lynn, Norfolk, East of England, England, PE30 1AR, United Kingdom",52.754891,0.3964614
848,"Market Rasen, United Kingdom","Market Rasen, West Lindsey, Lincolnshire, East Midlands, England, LN8 3EH, United Kingdom",53.3874028,-0.33665900000000004
849,"Margate, United Kingdom","Margate, Kent, South East, England, United Kingdom",51.389432899999996,1.3821515
850,"Gran Canaria, Spain","Gran Canaria, Tejeda, Las Palmas, Canarias, España",27.958000399999996,-15.6062305376665
851,"Mermaid Beach, Australia","Mermaid Beach, Gold Coast, Queensland, Australia",-28.044710600000002,153.4373204
852,"Brisbane, Australia","Brisbane, Queensland, 4004, Australia",-27.468968199999996,153.02349909999995
853,"Great Dunmow, United Kingdom","Great Dunmow, Essex, East of England, England, CM6 1AQ, United Kingdom",51.8720219,0.36283309999999996
854,"Kearsley, United Kingdom","Kearsley, Station Road, Stoneclough, Bolton, Greater Manchester, North West England, England, BL4 8ED, United Kingdom",53.544368999999996,-2.375213
855,"Dar es Salaam, Tanzania","Dar es-Salaam, Dar es Salaam, Coastal Zone, 00000, Tanzania",-6.8160837,39.280358299999996
856,"Winsor, United Kingdom","Winsor & Newton, Evesham Street, Notting Dale Village, North Kensington, Royal Borough of Kensington and Chelsea, London, Greater London, England, W11 4AJ, United Kingdom",51.511416499999996,-0.219487
857,"Welwyn, United Kingdom","Welwyn, Welwyn Hatfield, Hertfordshire, East of England, England, United Kingdom",51.837084999999995,-0.2027198848735445
858,"Pimlico, Australia","Pimlico, Townsville, Queensland, 4812, Australia",-19.276043100000006,146.7905733
859,"Innerleithen, United Kingdom","Innerleithen, Scottish Borders, Scotland, EH44 6HD, United Kingdom",55.619074399999995,-3.0633842999999996
860,"Europe, Europe","Europe, Rue de Madrid, Quartier de l'Europe, Paris, Île-de-France, France métropolitaine, 75008, France",48.8787676,2.3222642999999996
861,"Shepperton, United Kingdom","Shepperton, Spelthorne, Surrey, South East, England, United Kingdom",51.3957695,-0.448532
862,"Lincolnshire, United Kingdom","Lincolnshire, England, United Kingdom",53.182303399999995,-0.2031208542548153
863,"Caribbean, Caribbean","Pirates of the Caribbean, Caribbean Way, Bay Lake, Reedy Creek Improvement District, Orange County, Florida, 32830-8426, United States of America",28.417723100000003,-81.58484892224213
864,"Hailsham, United Kingdom","Hailsham, Wealden, East Sussex, South East, England, BN27 1BW, United Kingdom",50.8648011,0.2578904
865,"Honolulu, Hawaii","Honolulu, Honolulu County, Hawaii, United States of America",21.304547,-157.8556764
866,"Helston, United Kingdom","Helston, Cornwall, South West England, England, TR13 8GQ, United Kingdom",50.101673100000006,-5.273032
867,"Huddersfield, United Kingdom","Huddersfield, Kirklees, West Yorkshire, Yorkshire and the Humber, England, HD1 2AA, United Kingdom",53.6466645,-1.7822482
868,"Maputo, Mozambique","Cidade de Maputo, Mozambique",-25.966213,32.56745
869,"Worcester Park, United Kingdom","Worcester Park, London Borough of Sutton, London, Greater London, England, KT4 8DP, United Kingdom",51.3783998,-0.24160229999999996
870,"Gawcott, United Kingdom","Gawcott, Buckinghamshire, South East, England, MK18 4HY, United Kingdom",51.981089600000004,-1.010749
871,"Sheerness, United Kingdom","Sheerness, Kent, South East, England, ME12 1QF, United Kingdom",51.439170399999995,0.7585715000000001
872,"Bradford, United Kingdom","Bradford, West Yorkshire, Yorkshire and the Humber, England, United Kingdom",53.794422899999994,-1.7519186000000002
873,"Burton upon Trent, United Kingdom","Burton-on-Trent, Staffordshire, West Midlands, England, DE14 1JN, United Kingdom",52.802742,-1.629917
874,"South West England, United Kingdom","South West England, England, United Kingdom",51.0339991,-2.949011916021195
875,"Malmesbury, United Kingdom","Malmesbury, Wiltshire, South West England, England, SN16 9, United Kingdom",51.58447,-2.0982042
876,"Madeira, Portugal","Madeira, Portugal",32.751748750000004,-16.981752048847362
877,"Tenbury Wells, United Kingdom","Tenbury Wells, Worcestershire, West Midlands, England, WR15 8EY, United Kingdom",52.30841229999999,-2.5974041000000003
878,"Billingham, United Kingdom","Billingham, Stockton-on-Tees, North East England, England, United Kingdom",54.6071441,-1.2912166
879,"Costessey, United Kingdom","Costessey, Norfolk, East of England, England, NR8, United Kingdom",52.659294700000004,1.2100681999999998
880,"Las Vegas, USA","Las Vegas, Clark County, Nevada, United States of America",36.1672559,-115.1485163
881,"Dartmouth, United Kingdom","Dartmouth, Devon, South West England, England, TQ6 9ES, United Kingdom",50.3514839,-3.583844
882,"Nice, France","Nice, Alpes-Maritimes, Provence-Alpes-Côte d'Azur, France métropolitaine, France",43.700935799999996,7.2683912
883,"Dagenham, United Kingdom","Dagenham, London Borough of Barking and Dagenham, London, Greater London, England, RM10 8PE, United Kingdom",51.541327100000004,0.1481142
884,"Old Warden, United Kingdom","Old Warden, Central Bedfordshire, East of England, England, SG18 9HB, United Kingdom",52.083087299999995,-0.3411544
885,"Playa Blanca, Spain","Playa Blanca, Yaiza, Las Palmas, Canarias, 35580 YAIZA- PLAYA BLANCA - LANZAROTE-SPAIN, España",28.8670593,-13.829580300000002
886,"Peacehaven, United Kingdom","Peacehaven, Lewes, East Sussex, South East, England, United Kingdom",50.7969519,0.006895539586744439
887,"Hessle, United Kingdom","Hessle, East Riding of Yorkshire, Yorkshire and the Humber, England, HU13 0AA, United Kingdom",53.7231588,-0.4349309
888,"Warsash, United Kingdom","Warsash, Fareham, Hampshire, South East, England, SO31 9AF, United Kingdom",50.854507399999996,-1.2986547
889,"Lyme Regis, United Kingdom","Lyme Regis, Dorset, South West England, England, United Kingdom",50.7361334,-2.9317343744389417
890,"Bampton, United Kingdom","Bampton, Cumbria, North West England, England, CA10 2RS, United Kingdom",54.5571655,-2.7501702999999997
891,"South East England, United Kingdom","South East, England, United Kingdom",51.4510191,-0.993491440497516
892,"Yate, United Kingdom","Yate, South Gloucestershire, South West England, England, BS37, United Kingdom",51.540345,-2.4133093999999997
893,"Croughton, United Kingdom","Croughton, Stoak, Cheshire West and Chester, North West England, England, CH2 4DA, United Kingdom",53.24669220000001,-2.8723027
894,"Fontenay-le-Comte, France","Fontenay-le-Comte, Vendée, Pays de la Loire, France métropolitaine, 85200, France",46.46611220000001,-0.8063735
895,"Pau, France","Pau, Pyrénées-Atlantiques, Nouvelle-Aquitaine, France métropolitaine, 64000, France",43.2957547,-0.36856679999999997
896,"Poznan, Poland","Poznań, województwo wielkopolskie, Polska",52.40063215,16.91978694287606
897,"Cranfield, United Kingdom","Cranfield, Central Bedfordshire, East of England, England, MK43 0BS, United Kingdom",52.0690205,-0.6079317
898,"Stowmarket, United Kingdom","Stowmarket, Mid Suffolk, Suffolk, East of England, England, IP14 1ET, United Kingdom",52.187814700000004,0.9973428
899,"Kidderminster, United Kingdom","Kidderminster, Worcestershire, West Midlands, England, DY10 1EH, United Kingdom",52.3880787,-2.2478582
900,"bognor regis, united kingdom","Bognor Regis, Arun, West Sussex, South East, England, United Kingdom",50.7834973,-0.6730718000000001
901,"Hoddesdon, United Kingdom","Hoddesdon, Hertfordshire, East of England, England, EN11 8UD, United Kingdom",51.7616709,-0.0112898
902,"Culcheth, United Kingdom","Culcheth, Warrington, North West England, England, WA3 4EE, United Kingdom",53.4519289,-2.5225432999999997
903,"Cork, Ireland","Cork, Cork City 2019, County Cork, Munster, T12 EE6N, Ireland",51.8979282,-8.4705806
904,"Lutterworth, United Kingdom","Lutterworth, Leicestershire, East Midlands, England, LE17 4AT, United Kingdom",52.45522239999999,-1.1997815
905,"Appledore, United Kingdom","Appledore, Devon, South West England, England, United Kingdom",51.05397720000001,-4.1925211000000004
906,"Pooraka, Australia","Pooraka, City of Salisbury, South Australia, 5095, Australia",-34.825702299999996,138.6228595
907,"Woburn, United Kingdom","Woburn, Central Bedfordshire, East of England, England, United Kingdom",51.9874445,-0.6219307095051061
908,"Wynyard, Australia","Wynyard, York Street, Darling Quarter, Sydney, Council of the City of Sydney, 2000, Australia",-33.8659903,151.20580959999995
909,"New York City, USA","New York, United States of America",40.7127281,-74.0060152
910,"Brunei, Brunei",Brunei,4.4137154999999995,114.5653908
911,"Tadley, United Kingdom","Tadley, Basingstoke and Deane, Hampshire, South East, England, United Kingdom",51.3414473,-1.1446781163706068
912,"Fairlight, United Kingdom","Fairlight, Rother, East Sussex, South East, England, TN35 4BN, United Kingdom",50.8753155,0.6624181
913,"Son en Breugel, The Netherlands","Son en Breugel, Noord-Brabant, Nederland",51.517812799999994,5.491434707574257
914,"West Yorkshire, United Kingdom","West Yorkshire, Yorkshire and the Humber, England, United Kingdom",53.74142710000001,-1.7202003766777243
915,"Ivybridge, United Kingdom","Ivybridge, Devon, South West England, England, PL21 0AT, United Kingdom",50.3918419,-3.9177668
916,"Wales, United Kingdom","Cymru / Wales, United Kingdom",52.2928116,-3.7389300000000003
917,"Twyford, United Kingdom","Twyford, Buckinghamshire, South East, England, MK18 4EG, United Kingdom",51.9315564,-1.0358424000000002
918,"Kinver, United Kingdom","Kinver, Staffordshire, West Midlands, England, DY7 6HF, United Kingdom",52.4481307,-2.2284545
919,"Northumberland, United Kingdom","Northumberland, North East England, England, United Kingdom",55.25,-2.000559
920,"Oakham, United Kingdom","Oakham, Barleythorpe, Rutland, East Midlands, England, United Kingdom",52.66666035,-0.7499676404569892
921,"Tangmere, United Kingdom","Tangmere, Chichester, West Sussex, South East, England, United Kingdom",50.84520379999999,-0.7106906428470254
922,"Isleworth, United Kingdom","Isleworth, Hounslow, London, Greater London, England, TW7 7EL, United Kingdom",51.4683558,-0.32631109999999997
923,"Bexley Heath, United Kingdom","Business Academy Bexley, Yarnton Way, Belvedere, London Borough of Bexley, London, Greater London, England, DA18 4BL, United Kingdom",51.496438,0.1331549499999965
924,"Rebecq Rognon, Belgium","Rebecq-Rognon, Rebecq, Brabant wallon, Wallonie, 1430, België - Belgique - Belgien",50.65304370000001,4.12960583578223
925,"Jurbise, Belgium","Jurbise, Hainaut, Wallonie, 7050, België - Belgique - Belgien",50.532506700000006,3.9113179
926,"Skegness, United Kingdom","Skegness, Lincolnshire, East Midlands, England, PE25 2UJ, United Kingdom",53.143750600000004,0.34289580000000003
927,"Discovery Bay, USA","Discovery Bay, CA 4, Trull, San Joaquin County, California, 94505, United States of America",37.914774,-121.59400523623852
928,"Neutral Bay, Australia","Neutral Bay, Lower North Shore, North Sydney Council, 2089, Australia",-33.8342887,151.21820490000005
929,"Bagni di Lucca, Italy","Bagni di Lucca, Unione dei comuni Media Valle del Serchio, Lucca, Toscana, Italia",44.0099818,10.590633
930,"Ascona, Switzerland","Ascona, Circolo dell'Isole, Distretto di Locarno, Ticino, 6612, Switzerland",46.155422200000004,8.7707865
931,"Eastney, United Kingdom","Eastney, Portsmouth, South East, England, PO4 9SA, United Kingdom",50.787240999999995,-1.0476321
932,"Parga, Greece","Πάργα, Δήμος Πάργας, Περιφερειακή Ενότητα Πρέβεζας, Περιφέρεια Ηπείρου, Αποκεντρωμένη Διοίκηση Ηπείρου - Δυτικής Μακεδονίας, 48060, Ελλάδα",39.285257200000004,20.3998169
933,"Long Stratton, United Kingdom","Long Stratton, Norfolk, East of England, England, NR15 2XJ, United Kingdom",52.48782560000001,1.233093
934,"Athens, USA","Athens, Athens-Clarke County, Georgia, 303341458, United States of America",33.9597677,-83.376398
935,"Galway, Ireland","Cathair na Gaillimhe, County Galway, Connacht, Ireland",53.2744122,-9.049063199999999
936,"Zurich, Switzerland","Zürich, Bezirk Zürich, Zürich, Switzerland",47.3723941,8.5423328
937,"Pevensey, United Kingdom","Pevensey, Wealden, East Sussex, South East, England, BN24 5LA, United Kingdom",50.8203268,0.3392932
938,"Arcachon, France","Arcachon, Nouvelle-Aquitaine, France métropolitaine, 33120, France",44.653942799999996,-1.1755714
939,"Philadelphia, USA","Philadelphia, Philadelphia County, Pennsylvania, United States of America",39.9527237,-75.16352619999998
940,"Oving, United Kingdom","Oving, Chichester, West Sussex, South East, England, United Kingdom",50.828055000000006,-0.7168113484452061
941,"City of London, United Kingdom","City of London, Greater London, England, EC2V 5AE, United Kingdom",51.5156177,-0.0919983
942,"Toulouse, France","Toulouse, Haute-Garonne, Occitanie, France métropolitaine, France",43.6044622,1.4442469
943,"Boxgrove, United Kingdom","Boxgrove, Chichester, West Sussex, South East, England, United Kingdom",50.869577299999996,-0.7079943071612979
944,"Brockham, United Kingdom","Brockham, Surrey, South East, England, RH3 7JR, United Kingdom",51.2318775,-0.28625290000000003
945,"Fuerteventura, Spain","Fuerteventura, Antigua, Las Palmas, Canarias, España",28.40037685,-14.004869713542154
946,"Epping, United Kingdom","Epping, The Essex Way, Epping, Epping Forest, Essex, East of England, England, CM16 7AR, United Kingdom",51.6936318,0.11398879999999999
947,"Ruislip, United Kingdom","Ruislip, Footpath R167, Eastcote Village, Northwood, London Borough of Hillingdon, London, Greater London, England, HA4 6DE, United Kingdom",51.5714026,-0.4213375
948,"Eynsford, United Kingdom","Eynsford, Sevenoaks, Kent, South East, England, United Kingdom",51.35584405,0.19968779657052496
949,"Southern Wales, United Kingdom","Southern Way, Dominions Way Trading Estate, Penylan, Cardiff, Cymru / Wales, CF, United Kingdom",51.5029887,-3.1434092000000002
950,"Blackfield, United Kingdom","Blackfield, Hampshire, South East, England, SO45 1WE, United Kingdom",50.8179972,-1.3726143
951,"Newnham, United Kingdom","Newnham, Hertfordshire, East of England, England, SG7 5JX, United Kingdom",52.02099370000001,-0.18530370000000002
952,"West Drayton, United Kingdom","West Drayton, London Borough of Hillingdon, London, Greater London, England, UB7 7GD, United Kingdom",51.503513,-0.4662704000000001
953,"Radlett, United Kingdom","Radlett, Hertfordshire, East of England, England, WD7 7AP, United Kingdom",51.6843112,-0.31752790000000003
954,"North Wildwood, USA","North Wildwood, Cape May County, New Jersey, 08260-3058, United States of America",39.0006686,-74.79933299999998
955,"Finmere, United Kingdom","Finmere, Oxfordshire, South East, England, MK18 4BE, United Kingdom",51.9903279,-1.0738676999999999
956,"Marden, United Kingdom","Marden, Chichester, West Sussex, South East, England, United Kingdom",50.9333039,-0.8576048607169946
957,"South Coast, United Kingdom","Coast, Cavendish Square, Cavendish Square & Oxford Market (South), Fitzrovia, City of Westminster, London, Greater London, England, W1G 0LA, United Kingdom",51.5151805,-0.1439727
958,"Newquay, United Kingdom","Newquay, Station Parade, Newquay, Cornwall, South West England, England, TR7, United Kingdom",50.4143924,-5.0751373
959,"Gettysburg, USA","Gettysburg, Adams County, Pennsylvania, United States of America",39.8308973,-77.23101199999998
960,"Tonbridge Wells, United Kingdom","Tonbridge Grammar School, Deakin Leas, Brook Street, Tonbridge and Malling, Kent, South East, England, TN9 2JR, United Kingdom",51.1836381,0.2757338767323477
961,"St. Augustine,USA","St. Augustine, St. Johns County, Florida, 32084, United States of America",29.894695199999997,-81.3145395
962,"Stedham, United Kingdom","Stedham, Chichester, West Sussex, South East, England, GU29 0NH, United Kingdom",50.9941,-0.772464
963,"Balwyn, Australia","Balwyn, City of Boroondara, Victoria, 3103, Australia",-37.8091737,145.08336780000005
964,"Edmonton, Canada","Edmonton, Alberta, Canada",53.535410999999996,-113.50799599999999
