,Location,Coordinates,Latitude,Longitude
393,"Greenwich, United Kingdom","Greenwich, London, Greater London, England, SE10 9HF, United Kingdom",51.4820845,-0.0045417
394,"Lichfield, United Kingdom","Lichfield, Staffordshire, West Midlands, England, United Kingdom",52.6843696,-1.8275286
395,"Glasgow, United Kingdom","Glasgow, Glasgow City, Scotland, G2 9SA, United Kingdom",55.8609825,-4.2488787000000015
396,"Bedworth, United Kingdom","Bedworth, Warwickshire, West Midlands, England, CV12 9DQ, United Kingdom",52.4792826,-1.4663202
397,"Willand, United Kingdom","Willand, Mid Devon, Devon, South West England, England, EX15 2RQ, United Kingdom",50.8862619,-3.3718547999999995
398,"Adelaide, Australia","Adelaide, Adelaide City Council, South Australia, 5000, Australia",-34.928180499999996,138.5999312
399,"Tavistock, United Kingdom","Tavistock, Devon, South West England, England, PL19 8BB, United Kingdom",50.5496154,-4.1446358
400,"Cobham, United Kingdom","Cobham, Elmbridge, Surrey, South East, England, United Kingdom",51.3300079,-0.4120821
401,"Bodmin, United Kingdom","Bodmin, Cornwall, South West England, England, PL31 1JU, United Kingdom",50.470725,-4.7243205
402,"Chamonix, France","Chamonix-Mont-Blanc, Bonneville, Haute-Savoie, Auvergne-Rhône-Alpes, France métropolitaine, 74400, France",45.92467050000001,6.8727506
403,"Newport Pagnell, United Kingdom","Newport Pagnell, Milton Keynes, South East, England, MK16 8AB, United Kingdom",52.0863864,-0.7237340999999999
404,"West Itchenor, United Kingdom","West Itchenor, Chichester, West Sussex, South East, England, United Kingdom",50.79978199999999,-0.8737383071815931
405,"Earl Shilton, United Kingdom","Earl Shilton, Leicestershire, East Midlands, England, LE9 7AP, United Kingdom",52.5791017,-1.3049367
406,"Pagham, United Kingdom","Pagham, Arun, West Sussex, South East, England, PO21 4TN, United Kingdom",50.77069470000001,-0.7394133
407,"Ewell, United Kingdom","Ewell, Surrey, South East, England, KT17 1TZ, United Kingdom",51.3502402,-0.2511759
408,"Muscat, Oman","مسقط, سلطنة عُمان Oman",23.599785699999998,58.545130500000006
409,"Leicestershire, United Kingdom","Leicestershire, East Midlands, England, United Kingdom",52.666667000000004,-1.0
410,"La Ravoire, France","La Ravoire, Chambéry, Savoie, Auvergne-Rhône-Alpes, France métropolitaine, 73490, France",45.55490089999999,5.961516099999999
411,"Fontwell, United Kingdom","Fontwell, Arun, West Sussex, South East, England, BN18 0SW, United Kingdom",50.8552406,-0.6479148
412,"Chester, United Kingdom","Chester, Cheshire West and Chester, North West England, England, CH1 2ET, United Kingdom",53.1908873,-2.8908955
413,"Cornwall, United Kingdom","Cornwall, South West England, England, United Kingdom",50.416667,-4.75
414,"Carmarthen, United Kingdom","Carmarthen, Carmarthenshire, Cymru / Wales, SA31 1RT, United Kingdom",51.85912570000001,-4.3115907
415,"Chepstow, United Kingdom","Chepstow, Station Road, Chepstow, Monmouthshire, Cymru / Wales, NP16, United Kingdom",51.6399641,-2.6711113999999996
416,"Cape Town, South Africa","Cape Town, City of Cape Town, Western Cape, 8001, South Africa",-33.928992,18.417396
417,"Gloucestershire, United Kingdom","Gloucestershire, South West England, England, United Kingdom",51.7643786,-2.188066183871938
418,"Sedlescombe, United Kingdom","Sedlescombe, Rother, East Sussex, South East, England, TN33 0QP, United Kingdom",50.9404244,0.5292089
419,"West Molesey, United Kingdom","West Molesey, Molesey, Surrey, South East, England, KT8 1NT, United Kingdom",51.40477050000001,-0.3641342
420,"Tregony, United Kingdom","Tregony, Cornwall, South West England, England, TR2 5PZ, United Kingdom",50.2682766,-4.9125621
421,"Kingston upon Thames, United Kingdom","Kingston upon Thames, London, Greater London, England, KT1 1JS, United Kingdom",51.4096275,-0.3062621
422,"Shoreham By Sea, United Kingdom","Shoreham-by-Sea, Adur, West Sussex, South East, England, United Kingdom",50.832230700000004,-0.2746717
423,"Snowdonia National Park, United Kingdom","Snowdonia National Park, Cymru / Wales, United Kingdom",52.9155626,-3.8326012926334223
424,"Florida, USA","Florida, United States of America",27.7567667,-81.4639835
425,"Devon, United Kingdom","Devon, South West England, England, United Kingdom",50.724165,-3.660795843955193
426,"Derby, United Kingdom","Derby, East Midlands, England, DE1 2AA, United Kingdom",52.92126170000001,-1.4761491000000002
427,"West Huntspill, United Kingdom","West Huntspill, Sedgemoor, Somerset, South West England, England, United Kingdom",51.20805455,-2.9974996114026538
428,"Fremantle, Australia","Fremantle, City of Fremantle, Western Australia, 6959, Australia",-32.0558714,115.74616929999999
429,"Ruskington, United Kingdom","Ruskington, Lincolnshire, East Midlands, England, United Kingdom",53.0451565,-0.3966652900126128
430,"Burlington, Canada","Burlington, Halton Region, Golden Horseshoe, Ontario, Canada",43.3248924,-79.7966835
431,"Brecon, United Kingdom","Brecon, Powys, Cymru / Wales, LD3, United Kingdom",51.947204799999994,-3.391696
432,"Rotherham, United Kingdom","Rotherham, Yorkshire and the Humber, England, United Kingdom",53.4310417,-1.3551870000000001
433,"Nerja, Spain","Nerja, La Axarquía, Málaga, Andalucía, España",36.7468565,-3.8790164
434,"Frome, United Kingdom","Frome, Somerset, South West England, England, BA11 1LR, United Kingdom",51.227055799999995,-2.3192971
435,"Neyland, United Kingdom","Neyland, Pennar, Pembrokeshire, Cymru / Wales, United Kingdom",51.7099976,-4.9511343
436,"Witney, United Kingdom","Witney, Oxfordshire, South East, England, OX28 6PH, United Kingdom",51.78593660000001,-1.4850584999999998
437,"Esher, United Kingdom","Esher, Surrey, South East, England, United Kingdom",51.3693929,-0.3654406
438,"Windsor, United Kingdom","Windsor Castle, Thames Street, Long Walk Gate, Eton, Windsor and Maidenhead, South East, England, SL4 1LP, United Kingdom",51.48379805,-0.6041397427111339
439,"Torquay, United Kingdom","Torquay, South West England, England, TQ1 1TR, United Kingdom",50.465239200000006,-3.5211361000000005
440,"Daventry,  United Kingdom","Daventry, Northamptonshire, East Midlands, England, United Kingdom",52.2578681,-1.1626569
441,"Lancashire, United Kingdom","Lancashire, North West England, England, United Kingdom",53.8611703,-2.5650887919475496
442,"Macclesfield, United Kingdom","Macclesfield, Cheshire East, North West England, England, SK10 1AG, United Kingdom",53.2606635,-2.1255158
443,"Verwood, United Kingdom","Verwood, Dorset, South West England, England, BH31 7AT, United Kingdom",50.8801244,-1.8752368000000001
444,"Ramsgate, United Kingdom","Ramsgate, Kent, South East, England, CT11 9AD, United Kingdom",51.3334726,1.4196476
445,"Rishworth, United Kingdom","Rishworth, Calderdale, West Yorkshire, Yorkshire and the Humber, England, HX6 4QQ, United Kingdom",53.659067500000006,-1.9506259
446,"Stoke-on-Trent, United Kingdom","Stoke-on-Trent, West Midlands, England, ST1 4NP, United Kingdom",53.0162014,-2.1812607
447,"Pinner, United Kingdom","Pinner, London Borough of Harrow, London, Greater London, England, HA5 3AW, United Kingdom",51.5968712,-0.3770142
448,"Malta, Malta",Malta,35.888599299999996,14.4476911
449,"Denbigh, United Kingdom","Denbigh, Denbighshire, Cymru / Wales, LL16 3UH, United Kingdom",53.18537760000001,-3.4178288999999995
450,"Battle, United Kingdom","Battle, Rother, East Sussex, South East, England, TN33 0EE, United Kingdom",50.9177711,0.48365410000000003
451,"Le Temple-sur-Lot, France","Le Temple-sur-Lot, Villeneuve-sur-Lot, Lot-et-Garonne, Nouvelle-Aquitaine, France métropolitaine, 47110, France",44.3796482,0.5255504
452,"Ilkeston, United Kingdom","Ilkeston, Derbyshire, East Midlands, England, DE7 5JA, United Kingdom",52.971086899999996,-1.3071709999999999
453,"Dereham, United Kingdom","Dereham, Breckland, Norfolk, East of England, England, NR19 1FP, United Kingdom",52.6802052,0.9386329
454,"Cuffley, United Kingdom","Cuffley, Tolmers Road, Northaw and Cuffley, Welwyn Hatfield, Hertfordshire, East of England, England, EN6 4LA, United Kingdom",51.709146399999995,-0.1097981
455,"Framlingham, United Kingdom","Framlingham, Suffolk, East of England, England, IP13 9DP, United Kingdom",52.222057899999996,1.3415864
456,"Swaffham, United Kingdom","Swaffham, Norfolk, East of England, England, PE37 7QN, United Kingdom",52.6481171,0.6909259
457,"Leighton Buzzard, United Kingdom","Leighton Buzzard, Central Bedfordshire, East of England, England, LU7 1EE, United Kingdom",51.916579399999996,-0.6620550999999999
458,"Ascot, United Kingdom","Ascot, Windsor and Maidenhead, South East, England, SL5 7FW, United Kingdom",51.4101286,-0.6680194
459,"Sheffield,  United Kingdom","Sheffield, Yorkshire and the Humber, England, United Kingdom",53.38066260000001,-1.4702278
460,"Abingdon, United Kingdom","Abingdon, Oxfordshire, South East, England, OX14 3UJ, United Kingdom",51.6714842,-1.2779715
461,"Bromsgrove, United Kingdom","Bromsgrove, Worcestershire, West Midlands, England, United Kingdom",52.3353816,-2.0597449
462,"Mandurah, Australia","Mandurah, Western Australia, 6201, Australia",-32.5302495,115.72087820000002
463,"Coleorton, United Kingdom","Coleorton, North West Leicestershire, Leicestershire, East Midlands, England, LE67 8GJ, United Kingdom",52.75298860000001,-1.4032292
464,"Caddington, United Kingdom","Caddington, Central Bedfordshire, East of England, England, United Kingdom",51.8656601,-0.456191
465,"Ockenden, United Kingdom","Ockenden Manor Hotel & Spa, Ockenden Lane, Cuckfield, Mid Sussex, West Sussex, South East, England, RH17 5LD, United Kingdom",51.00726820000001,-0.14567817544393755
466,"Playa Paraiso, The Canaries","Playa Paraíso, Adeje, Santa Cruz de Tenerife, Canarias, 38678, España",28.1220218,-16.773150400000002
467,"Loughborough, United Kingdom","Loughborough, Charnwood, Leicestershire, East Midlands, England, LE11 5BJ, United Kingdom",52.772385899999996,-1.2077985
468,"Chicago, USA","Chicago, Cook County, Illinois, United States of America",41.87556160000001,-87.6244212
469,"Newmarket, United Kingdom","Newmarket, Suffolk, East of England, England, CB8 8NA, United Kingdom",52.244310299999995,0.4065503
470,"St Albans, United Kingdom","St Albans, Hertfordshire, East of England, England, United Kingdom",51.7492956,-0.34225259999999996
471,"Thurles, Ireland","Thurles, County Tipperary, Munster, E41 F838, Ireland",52.6801547,-7.8151008
472,"Edinburgh, United Kingdom","Edinburgh, City of Edinburgh, Scotland, EH1 3EG, United Kingdom",55.9533456,-3.1883749
473,"Chesterfield, United Kingdom","Chesterfield, Derbyshire, East Midlands, England, United Kingdom",53.2352134,-1.4264097
474,"Greater Manchester, United Kingdom","Greater Manchester, North West England, England, United Kingdom",53.50652485,-2.3374401422576687
475,"Beeston, United Kingdom","Beeston, Central Bedfordshire, East of England, England, SG19 1PE, United Kingdom",52.1191687,-0.2938263
476,"Maspalomas, Spain","Maspalomas, San Bartolomé de Tirajana, Las Palmas, Canarias, LAS PALMAS, España",27.752773100000002,-15.5970832
477,"Takeley, United Kingdom","Takeley, Essex, East of England, England, CM22 6SB, United Kingdom",51.868075299999994,0.266063
478,"Palm Coast, USA","Palm Coast, Flagler County, Florida, United States of America",29.5541432,-81.22076729999998
479,"Polesworth, United Kingdom","Polesworth, Orchard Close, Polesworth CP, North Warwickshire, Warwickshire, West Midlands, England, B78 1DB, United Kingdom",52.6258348,-1.6107049
480,"Seaford, United Kingdom","Seaford, East Sussex, South East, England, United Kingdom",50.77832265,0.11048025281493357
481,"Worksop, United Kingdom","Worksop, Nottinghamshire, East Midlands, England, S80 2AU, United Kingdom",53.304880000000004,-1.123572
482,"Sandy, United Kingdom","Sandy, Central Bedfordshire, East of England, England, SG19 1UH, United Kingdom",52.1295713,-0.29316570000000003
483,"Godalming, United Kingdom","Godalming, Surrey, South East, England, GU7 1EA, United Kingdom",51.1857892,-0.6149074000000001
484,"Burgess Hill, United Kingdom","Burgess Hill, Mid Sussex, West Sussex, South East, England, RH15, United Kingdom",50.957536499999996,-0.1332853
485,"Hanham, United Kingdom","Hanham, Kingswood, South Gloucestershire, South West England, England, BS15, United Kingdom",51.4496075,-2.5163717999999995
486,"Durban, South Africa","Durban, eThekwini Metropolitan Municipality, KwaZulu-Natal, 4057, South Africa",-29.861825,31.009909000000004
487,"Dunedin, New Zealand","Dunedin, Dunedin City, Otago, 9016, New Zealand",-45.8740984,170.50357549999995
488,"Glastonbury, United Kingdom","Glastonbury, Somerset, South West England, England, BA6 9, United Kingdom",51.14804,-2.716577
489,"New Ash Green, United Kingdom","New Ash Green, Kent, South East, England, DA3 8JF, United Kingdom",51.365741799999995,0.3035691
490,"Harleston, United Kingdom","Harleston, Suffolk, East of England, England, IP14 3HZ, United Kingdom",52.2024214,0.9465453000000001
491,"Burnham, United Kingdom","Burnham, Sandringham Court, Cippenham, Britwell, Slough, South East, England, SL1 6JD, United Kingdom",51.5233926,-0.6470844
492,"Newton Abbot, United Kingdom","Newton Abbot, Andy Bush Close, Newton Abbot, Teignbridge, Devon, South West England, England, TQ12 4AB, United Kingdom",50.5301513,-3.5992265
493,"Penwortham, United Kingdom","Penwortham, Lancashire, North West England, England, PR1 0DY, United Kingdom",53.749803299999996,-2.7301702999999997
494,"Carterton, United Kingdom","Carterton, Oxfordshire, South East, England, OX18 3XX, United Kingdom",51.759295200000004,-1.5945428999999998
495,"Lincoln, United Kingdom","Lincoln, Lincolnshire, East Midlands, England, United Kingdom",53.2336301,-0.5392172
496,"London,  United Kingdom","London, Greater London, England, SW1A 2DX, United Kingdom",51.5073219,-0.1276474
497,"Cheadle, United Kingdom","Cheadle, Staffordshire Moorlands, Staffordshire, West Midlands, England, United Kingdom",52.9900566,-1.9767685243941964
498,"Bidford-on-Avon, United Kingdom","Bidford on Avon, Warwickshire, West Midlands, England, B50 4NL, United Kingdom",52.1656073,-1.8558927
499,"Midlands, United Kingdom","Midlands, West Devon, Devon, South West England, England, PL19 9NF, United Kingdom",50.598892600000006,-4.1006857000000005
500,"High Ongar, United Kingdom","High Ongar, Essex, East of England, England, CM5 9ND, United Kingdom",51.7105656,0.26415959999999994
501,"Broadstairs, United Kingdom","Broadstairs, Kent, South East, England, CT10 1LP, United Kingdom",51.3586758,1.4407855
502,"Klang, Malaysia","KD14 Klang, Jalan Besar, Taman Eng Ann, Kampung Atap, Majlis Perbandaran Klang, Selangor, 41400, Malaysia",3.0431253,101.4496105689314
503,"Uckfield, United Kingdom","Uckfield, Wealden, East Sussex, South East, England, TN22 1RA, United Kingdom",50.9709535,0.0963279
504,"Rome, Italy","Roma, Roma Capitale, Italia",41.8933203,12.4829321
505,"Albufeira, Portugal","Albufeira, Faro, Algarve, Portugal",37.144524,-8.214588148218034
506,"Stratford-Upon-Avon, United Kingdom","Stratford-upon-Avon, Warwickshire, West Midlands, England, CV37 6AH, United Kingdom",52.1927885,-1.7063668
507,"Girvan, United Kingdom","Girvan, Ayrshire, Scotland, KA26 9BT, United Kingdom",55.24131510000001,-4.8553579000000004
508,"Woodford, United Kingdom","Woodford, Charteris Road, Woodford, London Borough of Redbridge, London, Greater London, England, IG8 7QE, United Kingdom",51.6068055,0.034011900000000005
509,"Isle of Man, United Kingdom","Isle of Man, Ramsgreave, Ribble Valley, Lancashire, North West England, England, BB1 9BW, United Kingdom",53.7795873,-2.4833689999999997
510,"Brixham, United Kingdom","Brixham, South West England, England, TQ5 8EP, United Kingdom",50.3952404,-3.5145440000000003
511,"Edenbridge, United Kingdom","Edenbridge, Sevenoaks, Kent, South East, England, United Kingdom",51.1907598,0.07297902946867366
512,"Marston Moretaine, United Kingdom","Marston Moretaine, Central Bedfordshire, East of England, England, MK43 0LE, United Kingdom",52.0698414,-0.5414541
513,"Market Weighton, United Kingdom","Market Weighton, East Riding of Yorkshire, Yorkshire and the Humber, England, YO43 3AJ, United Kingdom",53.8643625,-0.6679698000000001
514,"Bordon, United Kingdom","Bordon, Hampshire, South East, England, United Kingdom",51.1091184,-0.8593356
515,"New York , USA","New York, United States of America",40.7127281,-74.0060152
516,"Oberhausen, Germany","Oberhausen, Nordrhein-Westfalen, Deutschland",51.469613700000004,6.851443499999999
517,"Winchester, United Kingdom","Winchester, Hampshire, South East, England, United Kingdom",51.0612766,-1.3131692
518,"Brussels, Belgium","Bruxelles / Brussel, Ville de Bruxelles - Stad Brussel, Région de Bruxelles-Capitale - Brussels Hoofdstedelijk Gewest, België - Belgique - Belgien",50.8465573,4.351697
519,"Pietermaritzburg, South Africa","Pietermaritzburg, uMgungundlovu District Municipality, KwaZulu-Natal, 3201, South Africa",-29.6,30.378888899999996
520,"Walsall, United Kingdom","Walsall, West Midlands Combined Authority, West Midlands, England, United Kingdom",52.58479490000001,-1.9822686999999999
521,"Bonita Springs, USA","Bonita Springs, Lee County, Florida, United States of America",26.352575800000004,-81.8211122
522,"Yateley, United Kingdom","Yateley, Hart, Hampshire, South East, England, United Kingdom",51.33699665,-0.8165969783072189
523,"Oswestry, United Kingdom","Oswestry, Shropshire, West Midlands, England, SY11 1PX, United Kingdom",52.8603096,-3.0548201
524,"Enfield, United Kingdom","Enfield, London, Greater London, England, EN2 6LD, United Kingdom",51.6520851,-0.08101749999999999
525,"Wool, United Kingdom","Wool, Dorset, South West England, England, BH20 6BW, United Kingdom",50.67887020000001,-2.2205432999999997
526,"Johannesburg, South Africa","Johannesburg, City of Johannesburg Metropolitan Municipality, Gauteng, 2001, South Africa",-26.205,28.049721999999996
527,"Mons, Belgium","Mons, Hainaut, Wallonie, België - Belgique - Belgien",50.4549568,3.9519580000000003
528,"Comber, United Kingdom","Comber, County Down, Northern Ireland, BT23 5DZ, United Kingdom",54.54983420000001,-5.7454313
529,"Gerrards Cross, United Kingdom","Gerrards Cross, Buckinghamshire, South East, England, United Kingdom",51.58521845,-0.5616400011849038
530,"Vancouver Island, Canada","Vancouver Island, Area D (Oyster Bay/Buttle Lake), Strathcona Regional District, British Columbia, Canada",49.592949450000006,-125.70255696124094
531,"Romsey, United Kingdom","Romsey, Test Valley, Hampshire, South East, England, United Kingdom",50.9932664,-1.4895057794851212
532,"Salo, Finland","Salo, Salon seutukunta, Varsinais-Suomi, Manner-Suomi, Suomi",60.384671600000004,23.1286377
533,"Cuijk, The Netherlands","Cuijk, Noord-Brabant, Nederland",51.729939,5.8800457999999995
534,"Olympia, USA","Olympia, Thurston County, Washington, United States of America",47.0451022,-122.89500749999999
535,"Cowes, United Kingdom","Cowes, Isle of Wight, South East, England, United Kingdom",50.75762475000001,-1.3035640666867363
536,"Virginia, USA","Virginia, United States of America",37.1232245,-78.4927721
537,"Chesham, United Kingdom","Chesham, Buckinghamshire, South East, England, HP5 1BX, United Kingdom",51.7062914,-0.6123113
538,"Worcester, United Kingdom","Worcester, Worcestershire, West Midlands, England, United Kingdom",52.191184899999996,-2.2206585
539,"Wallington, United Kingdom","Wallington, London Borough of Sutton, London, Greater London, England, SM6 0LT, United Kingdom",51.357945,-0.1495621
540,"Jerrabomberra, Australia","District of Jerrabomberra, Australian Capital Territory, ACT 2609, Australia",-35.3644859,149.16204209999995
541,"Stockton-on-Tees, United Kingdom","Stockton-on-Tees, North East England, England, United Kingdom",54.564094,-1.3129164
542,"Totton, United Kingdom","Totton, Hampshire, South East, England, United Kingdom",50.9196406,-1.4894631
543,"Midi -Pyrenees, France","Midi-Pyrénées, Occitanie, France métropolitaine, France",43.8099068,1.4344926056549236
544,"Amsterdam, The Netherlands","Amsterdam, Noord-Holland, Nederland",52.37454030000001,4.897975505617977
545,"Wilmington, United Kingdom","Wilmington, Wealden, East Sussex, South East, England, BN26 5SQ, United Kingdom",50.8213657,0.194449
546,"Tauranga, New Zealand","Tauranga, Tauranga City, Bay of Plenty, 3143, New Zealand",-37.6859006,176.167505
547,"Cranleigh, United Kingdom","Cranleigh, Waverley, Surrey, South East, England, United Kingdom",51.135573799999996,-0.4917168329315532
548,"Hythe, United Kingdom","Hythe, Kent, South East, England, CT21 6FB, United Kingdom",51.0691421,1.0841633999999998
549,"St. Lucia, The Caribbean","East Caribbean Village, Reduit Park, Bonne Terre, Rodney Bay, Gros Islet, LC01 601, Saint Lucia",14.073283100000001,-60.9548015
550,"Doncaster, United Kingdom","Doncaster, Yorkshire and the Humber, England, United Kingdom",53.5227681,-1.1335312
551,"Grange-over-Sands, United Kingdom","Grange-over-Sands, Cumbria, North West England, England, LA11 6DS, United Kingdom",54.19306329999999,-2.9094791
552,"Pembrokeshire, United Kingdom","Pembrokeshire, Cymru / Wales, United Kingdom",51.833920899999995,-4.9166669999999995
553,"Redditch, United Kingdom","Redditch, Worcestershire, West Midlands, England, United Kingdom",52.3057655,-1.9417444
554,"East Preston, United Kingdom","East Preston, Arun, West Sussex, South East, England, BN16 1NH, United Kingdom",50.8087876,-0.48321709999999995
555,"Wath-upon-Dearne, United Kingdom","Wath upon Dearne, Yorkshire and the Humber, England, S63 7RZ, United Kingdom",53.502523499999995,-1.3450651000000002
556,"Broxbourne, United Kingdom","Broxbourne, Hertfordshire, East of England, England, United Kingdom",51.7465723,-0.0190782
557,"East Grinstead, United Kingdom","East Grinstead, Mid Sussex, West Sussex, South East, England, RH19 3AJ, United Kingdom",51.1322179,-0.0117661
558,"Cambridgeshire, United Kingdom","Cambridgeshire, East of England, England, United Kingdom",52.333333,0.083333
559,"Tonbridge, United Kingdom","Tonbridge, Tonbridge and Malling, Kent, South East, England, TN9 2AN, United Kingdom",51.1889529,0.2735876
560,"Pontefract, United Kingdom","Pontefract, Wakefield, West Yorkshire, Yorkshire and the Humber, England, WF8 1AG, United Kingdom",53.6917422,-1.3105722
561,"Eton Wick, United Kingdom","Eton Wick, Windsor, Windsor and Maidenhead, South East, England, SL4 6JW, United Kingdom",51.4973417,-0.6356248999999999
562,"Carmarthenshire, United Kingdom","Carmarthenshire, Cymru / Wales, United Kingdom",51.89366985,-4.217282721429928
563,"Upminster, United Kingdom","Upminster, Station Approach, Upminster, London Borough of Havering, London, Greater London, England, RM14 2FF, United Kingdom",51.55895020000001,0.2520875
564,"New South Wales, Australia","New South Wales, Australia",-31.875983500000004,147.2869493
565,"Portchester, United Kingdom","Portchester, The Crossway, Portchester, Fareham, Hampshire, South East, England, PO16 8NT, United Kingdom",50.8488575,-1.1247314
566,"Geervliet, The Netherlands","Geervliet, Nissewaard, Zuid-Holland, Nederland",51.85283445,4.264794784785802
567,"Waterford, Ireland","Waterford, County Waterford, Munster, X91 YA2H, Ireland",52.260999700000006,-7.111908099999999
568,"Khartoum, Sudan","الخرطوم, ولاية الخرطوم, ١١١١١, السودان ‎al-Sūdān",15.593325,32.53565
569,"Great Bedwyn, United Kingdom","Great Bedwyn, Wiltshire, South West England, England, SN8 3NU, United Kingdom",51.379406,-1.601919
570,"Uxbridge, United Kingdom","Uxbridge, London Borough of Hillingdon, London, Greater London, England, UB8 1SB, United Kingdom",51.544950899999996,-0.4816672000000001
571,"Centurion, South Africa","Centurion, City of Tshwane Metropolitan Municipality, Gauteng, 0046, South Africa",-25.836389,28.180278
572,"Storrington, United Kingdom","Storrington, Horsham, West Sussex, South East, England, RH20 4EE, United Kingdom",50.918445399999996,-0.45555
573,"Garibaldi Highlands, Canada","Garibaldi Highlands, Squamish, Squamish-Lillooet Regional District, British Columbia, V8B 0N8, Canada",49.745309000000006,-123.1131832
574,"Pasadena, USA","Pasadena, Los Angeles County, California, United States of America",34.14764520000001,-118.14447790000001
575,"Caerphilly, United Kingdom","Caerphilly, Cymru / Wales, United Kingdom",51.6723809,-3.178393772876317
576,"Godstone, United Kingdom","Godstone, Tilburstow Hill, South Godstone, Godstone, Tandridge, Surrey, South East, England, RH9 8EU, United Kingdom",51.2181855,-0.051436300000000004
577,"Cootamundra, Australia","Cootamundra, Cootamundra-Gundagai Regional Council, 2590, Australia",-34.6394513,148.025723
578,"Findon, United Kingdom","Findon, Arun, West Sussex, South East, England, BN14 0TE, United Kingdom",50.8680259,-0.4072606
579,"St Andrews, United Kingdom","St Andrews, Fife, Scotland, KY16 9PA, United Kingdom",56.3403902,-2.7955843999999996
580,"Yeovil, United Kingdom","Yeovil, South Somerset, Somerset, South West England, England, United Kingdom",50.9420451,-2.6318629000000002
581,"Chew Stoke, United Kingdom","Chew Stoke, Bath and North East Somerset, South West England, England, BS40 8XE, United Kingdom",51.3538006,-2.6338865
582,"Perth, Australia","Perth, Western Australia, 6000, Australia",-31.95271210000001,115.86047959999999
583,"Ormskirk, United Kingdom","Ormskirk, Station Approach, Aughton Park, West Lancashire, Lancashire, North West England, England, L39 2YN, United Kingdom",53.5694489,-2.8810819
584,"Saxmundham, United Kingdom","Saxmundham, Suffolk, East of England, England, IP17 1DF, United Kingdom",52.2142535,1.4918008999999999
585,"Stourbridge, United Kingdom","Stourbridge, Dudley, West Midlands Combined Authority, West Midlands, England, DY8 1DN, United Kingdom",52.4577615,-2.1474345
